metric,type,rationale
"Concentration (HHI, top-N share)",Lagging/static,Snapshot of the current book
Charge-off rate by industry/size/vintage,Lagging,Realised write-offs
Vintage cohort charge-off curves,Lagging,Cumulative realised losses by age
Loan-age transition (when charge-offs occur),Lagging,Realised default timing
Stage proxy (performing vs defaulted),Lagging,Terminal status only
Problem-exposure layer (DELINQ/PSTDUE/LIQUID),Leading,Pre-charge-off pipeline; IN LIQUIDATION ~ certain future charge-off
Origination volume/mix trend by approval year,Leading,Mix shift in what is being written leads the future charge-off rate
Vintage-over-vintage early-MOB charge-off,Leading,Young cohort deteriorating faster than predecessors at the same age
